<?xml version="1.0" encoding="UTF-8"?>
<!--Sample XML file generated by XMLSpy v2011 sp1 (http://www.altova.com)-->
<composerTable xsi:schemaLocation="http://www.cs.sjsu.edu/cs157b/Composer composer.xsd" xmlns="http://www.cs.sjsu.edu/cs157b/Composer" xmlns:xsi="http://www.w3.org/2001/XMLSchema-instance">
	<composer>
		<composerId>4</composerId>
		<composerName>Robert DeLeo</composerName>
	</composer>
	<composer>
		<composerId>5</composerId>
		<composerName>Kurt Cobain</composerName>
	</composer>
	<composer>
		<composerId>6</composerId>
		<composerName>Billy Corgan</composerName>
	</composer>
</composerTable>
